post_dates,title,full_text,url
2018-07-01,"남애항, 설레임펜션","["" 휴 우.. 정신없던 일요일이 저물어가네요. 오늘의 주제는 <정글의 법칙> 병만족 빙의한 자급자족 라이프, 조개채집 입니다. (거창하게 시작하지만 역시 별 볼 일없는 뻘글이라는...;) 주말은 시간이 통 안날것 같기에 주말전에 잠시 짬을 내서 다녀왔어요. 해수욕장이 본격적으로 개장하는 매년 이맘때, 한두번씩 조개잡이를 하곤 했는데 작년에는 뜬금이 육아관계로 부득이 한 해 걸렀어요. 그러니까 이번 채집은 2년만에 다시 재개한거죠. 오늘의 사냥터는 남애3리 해수욕장 '강원도 양양'은 해안가를 따라 크고 작은 해변이 수없이 늘어서 있지만, 유독 남애3리해변이 수심이 얕기 때문에 저 같은 수영 못하는 하등생물도 마음놓고 조개를 쓸어담을 수 있는 구역이예요. 준비물은 양파망(제일중요), 썬크림, 수건 끝 양파망은 조개 잡을때 꽤 유용해요. 그냥 해보시면 조개 옮길때 제일 편하죠-0- 이윽고 남애3리 해수욕장 에 당도했어요, 역시나 물 맑은 동해바다 엊그제(금요일) 방문한터라 조금은 한산한 분위기예요 오바하자면, 와이키키 부럽지 않은 양양바다 소심하게 신발은 테이블 밑에 숨겨두고 입수해봐요 셀프 기념샷 나 혼자 온 관계로 사진 찍어줄 사람이 없음 청어새끼 같은 놈들도 잡았어요 오오 ... (시간경과) 조개잡는 과정을 순서대로 찍었어야 했는데, 저 혼자 가서 잡은거라 과정샷이 없어요 조개 잡으며 셀카 찍을수는 없으니까 흑흑.. (현재 여보님과 뜬금이는 장기간 친정생활 중;) 조개잡는 방법은 간단해요. 그냥 물가에 주저앉아서 (포크레인이 흙 푸듯이) 한손으로 모랫속을 쓰윽 헤집다보면 손가락 사이에 조개껍데기가 걸려요. 혹은 이동중에 발에 걸리는 조개도 많아요. 모래만 밟다보면 그 딱딱한 촉감이 있어서 감이 딱 오죠 와, 근데 충격적인건.. 조개가 없어도 너무 없어요; 2년전에 한시간 동안 잡은 양의 반에 반도 안되는 양이예요, 허허 요게 2년전에 같은 장소에서 잡았던건데.. 흐음; [남애해수욕장] 강원도 조용한 해수욕장에서 조개잡이를.. [남애해수욕장] 맨손조개잡이 및 먹방 올해도 어김없이 해수욕장 개장에 발맞춰 조개채집을 하고 왔습니다.... blog.naver.com 사람들이 너무 많이 잡아가서 씨가 말랐나... 어쨌든 민망하지만 이번에 잡은 양,, 한시간 동안의 결과물이예요 식용가능한 민들조개 씁쓸한 마음 뒤로하고 일단 잡은건 해감부터 해놔요. 자급자족 컨셉이니 먹어치워야죠. 왕소금 투하하고 다음날까지 냉장숙성 (냉장고 맨윗칸이라 각도가 안나옴--) 너무 땡볕에 대놓고 돌아다녔나,, 팔이 익었어요 조개탕으로 숙취해소 다음날(토요일) 양양 방문한 여자동생사람이 본격적으로 조개탕 제조를 시작했어요. 사실 조개탕은 레시피라 할 것도 없음-- 밤새 모래를 토해낸 조개들 흐르는 물로 한번더 박박 씻겨줘요 적당히 물 넣고 끓이다가 하얀거품은 걷어내고 기호에 따라 고추,마늘 투하하고 팔팔팔 끓여주면 끝 별다른 조미료나 양념이 필요없는 초간단 메뉴 오늘밤의 메인은 활어회예요, 정신없어서 이번 회먹방 포스팅은 패스-0- 모듬회 3만원 + 오징어회 1만원 = 도합 4만원짜리 식탁 멍게는 서비스죠 열심히 음주신공 펼치다가 마지막에 조개탕으로 속풀고 뻗었어요; 양이 적었지만, 세 명이 한 그릇씩 먹을 양은 나오더라구요. 요것이 말캉말캉한 민들조개속살 아무튼 이상했어요, 그 많던 조개가 다 어디로 사라진건지.. 해수욕장이 이제 막 개장해서 벌써 사람들이 다 잡아간건 아닐텐데 말이죠. 주중에 시간되면 다른 해변을 공략해 봐야겠어요. 아, 오늘 저녁도 남애해변은 그림이었네유 남애3리해수욕장 강원도 양양군 현남면 남애리 저장 관심 장소를 MY플레이스 에 저장할 수 있어요. 팝업 닫기 '내 장소' 폴더에 저장했습니다. MY플레이스 가기 팝업 닫기 전화 상세보기 <a onclick=return false; href=bSize style=display:none target=blank class=semaplink selink data-linktype=map data-linkdata={&quot;eventTarget&quot;:&quot;button&quot;,&quot;didSearch&quot;:&quot;true&quot;,&quot;searchEngine&quot;:&quot;NAVER&quot;,&quot;locationId&quot;:&quot;13491156&quot;,&quot;latitude&quot;:&quot;37.9460661&quot;,&quot;markerLatitude&quot;:&quot;37.9460661&quot;,&quot;markerLongitude&quot;:&quot;128.7845225&quot;,&quot;title&quot;:&quot;남애3리해수욕장&quot;,&quot;longitude&quot;:&quot;128.7845225&quot;}>지도보기</a> 클릭하면 홈페이지 떠요++ 조개잡이 동해안조개잡이 강원도조개잡이 양양조개잡이 맨손조개잡이 민들조개 조개탕 남애해수욕장 남애3리해수욕장 남애해변 남애항 남애설레임펜션 양양설레임펜션 설레임펜션""]",http://blog.naver.com/PostView.nhn?blogId=heartbreak79&logNo=221319715973&redirect=Dlog&widgetTypeCall=true&directAccess=false
2019-08-01,행복한 가정은 미리...,[' 올 여름 가족의 휴가지는 전날 급하게 결정한 바다  얼마만에 제대로된 여름바다를 가는건지..  사천해수욕장 가려다가 엄마가 애들은 남애가 좋다고 추천하셔서 급히 남애해수욕장으로 결정.  가보자 얼마 걸리지도 않아 이제 2시간 이내 거리는 뭐   남애해변을 찍었더니 이상한곳 도착해서 오는길 봤던 남애항쪽으로 가니 주차할곳도 많고 제대로 찾아간듯  넘나 날씨가 좋으니 파라솔을 빌리자 성수기가 끝나서 그런가 바가지는 아닌듯하다.  뭐 만원정도는 투자해야지  바다보자 신난 아들 바로 뛰어들어서 신난 아이들..   오 멋지게 나왔어. 마치 수상안전요원같아.. 마침 깃발도 옆에 있어서 설정샷   해맑은 강  파도오 하나된 딸   생각보다 물이 너무 깨끗했다.  아빠와 같이 놀기  그냥 사진으로 추억해보자  이 불가사리는 모래사장에서 난 처음봤어 그래서 신기해서 한컷    애벌레가 허물벗고 나오듯 우리강이도 한번   이 치킨과 맥주는 3만원  엄마만 신났던 치맥타임   우리 파라솔을 꾸며줌  바다에 안들어간 엄마 작품 고로 내작품 내가 모래놀이함  조개들 주어와서 나름의 데코까지  이건 바다좀비냐  이걸로 아이들 스스로 놀기함   그렇게 신나게 짧고 굵게 놀다옴  온수샤워장도 어른 4000 어린이 3000해서 만원으로 정말 물로 한번 씻기만 함 난 물에 안들어가서 안씻었음    그리곤 집으로 오는내내 나는 아이들과 차에서 기절했다는 훈훈한 이야기을 마무리로   휴가 끝'],http://blog.naver.com/PostView.nhn?blogId=6014mina&logNo=221626204663&redirect=Dlog&widgetTypeCall=true&directAccess=false
2019-07-01,남애#남애3리해수욕...,"[' 남애항(남애3리, 남애)해수욕장에서 여름나기 하시면, 후회하지 않을 실겁니다. 특히, 가족 단위 시라면, 펜션. 민박을 강추합니다. 즐길 거리가 많은 양양 남애(남애3리, 남애항)바다입니다. 해수욕장이 남애항을 중심으로 남애3리해수욕장과 지경리 해수욕장을 좌우로 끼고 있구요. 양양최대 규모의 항인 남애항에서는 거의 365일 내내 새벽 경매시장이 열립니다. 자연산회를 3만원이면 4인가족이 충분이 먹고도 남을 수 있을 정도로 저렴합니다. 항에서는 항상 낚시하는 사람들이 있구요. 솟은 바위 위에서도 낚시대를 던지는 모습을 왕왕 볼수 있습니다. 또, 해수욕장 말고도 계곡이 가깝게 있어서 명품 어성전계곡과 법수치계곡을 가보시기를 추천합니다. 펜션. 민박은 돌고래마루펜션.민박으로 전화주세요 010-5696-2133 돌고래마루 펜션/민박에서 보는 남애항 전경입니다. 위 사진에서 보이는 남애항에서 낚시는 물론 경매시간 잘 마추시면, 자연산회와 함께 소라. 문어등을 구입할 수 있습니다. 남애/남애항/남애3리해수욕장 펜션.민박.. 수심이 낮은 남애3리해수욕장입니다. 수심이 낮고, 백사장은 넓고 남애리의 자랑이죠 남애(남애3리,남애항)해수욕장에서 펜션. 민박하세요 010-5696-2133 남애(남애항,남애3리해수욕장)해수욕장펜션.민박 돌고래마루 남애3리(남애항,남애)해수욕장펜션.돌고래마루펜션/민박 이제 막바지 예약입니다. 남은 기간 확인하시고 전화주세요 010-5696-2133 남애3리해수욕장 남애3리해수욕장펜션 남애3리해수욕장민박 남애해수욕장 남애해수욕장펜션 남애해수욕장민박 남애해수욕장펜션민박 남애항 남애항펜션 남애항민박 양양계곡 양양계곡펜션']",http://blog.naver.com/PostView.nhn?blogId=pes6413&logNo=221597168519&redirect=Dlog&widgetTypeCall=true&directAccess=false
2019-08-01,천하무적 서자매와 함께하는...,[' 20190818일욜 당일치기로 양양 남애해수욕장 다녀왔다 가끔 이렇게 당일치기로 다니는 우리 :-)  오늘 역쉬 자고 있는 서자매 보쌈해서 새벽에 출발   운전하니라 신랑은 고생하고 여자 셋 꿀잠자고 눈떠보니 남애해수욕장  신랑 고마웟   대충 대여료는 이정도 그늘막 챙겨간 우리는 자리세 지불   튜브에 바람넣고 챙겨간 스노클로 바다탐색   첫찌가 찍은 물고기 사진   신나게 놀고 강릉중앙시장에서 사 온 닭강정 먹기 완죤 꿀맛    운전해야하는 신랑은 휴식시간 잘자   여자 셋 놀고 놀고 또 놀고 신나 신나 :D   실컷 놀고 집으로   한적하고 조흐다 또또 오고 싶은 곳이다    남애1리해수욕장 강원도 양양군 현남면 남애1리  '],http://blog.naver.com/PostView.nhn?blogId=ryune1486&logNo=221620966287&redirect=Dlog&widgetTypeCall=true&directAccess=false
2019-07-01,"좋""은기""억","[' 2019.07.21. 촬영  양양에 놀러갔다가 그냥 오기 아쉬워서 서핑을 배워보기로 했다  오빠는 안배운다고해서 나도 그냥 말까 했는데  아무리 생각해도 오빠때문에 나까지 안해보는건 너무 아쉬워서 나혼자 배움  서핑을 배우기엔 날씨랑 파도가 좋지 않다고 빠꾸먹었는데  거의 조르다시피해서 배웠다   노빠꾸 못먹어도고 어차피 배울거면 그냥 빨리 시작할걸  준비좀 하고 올 걸  게다가 밥먹고와서 바로 배우려니까 더부룩  서핑슈트를 빌렸는데 제일 작은사이즈가 컸다  초등학생용 입어야 하나........  서핑 슈트 안에 뭘 입어야 할 지 몰랐는데  검색해보니까 비키니를 입거나, 아무것도 안입는게 가장 좋다고 글쓰고 보니 정말 몸집이 초등학생같다  강습있는 날이 아닌데 신청해서  1대1 강습이 됐다  저 하나를 위해  감사합니다 구슬땀을 뚝뚝 흘리며 열심히 가르쳐주신 서핑 강사님  그리 더운 날씨는 아니었는데  서핑보드 위에서 엎드렸다 일어났다 반복하니까 덥고 숨이찼다  땅에서 연습을 빡세게 하고 물에 들어가야 한다고 했다 해무가 밀려들어오는 양양 남애 해수욕장  대낮에 해무 밀려오는거 진짜 멋있었다  드디어 바다를 향해 감 서핑보드가 엄청나게 무거웠다 바다를 향해 들어갈때에는 파도에 의해 서핑보드가 사람을 공격할 수가 있다  이토록 무거운 서핑보드에 맞을 생각하면 엄청 무서웠다  머리에 직격타 당하면 최소 경추 골절 일 듯   이럴땐 한 손으론 보드를 눌러주고, 다른 한 손으로는 서핑보드 끝쪽을 살짝 눌러줘서  보드 끝쪽으로 파도를 뛰어넘어가듯 해줘야 한다  아, 어떻게 설명해야하지... 물 속에서 걷기가 힘들면 이렇게 패들링해서 들어가면 된다  파도 역방향으로 패들링하는거라 잘 안들어가질 줄 알았는데  파도가 엄청 쎈 해변가가 아니면 생각보다 잘 들어가진다 한창 더울 시간에 들어갔는데 물온도 실화냐   진짜 차가웠다  겨울 바다에 들어간 듯 한 느낌이었다  강사님 오들오들 떠시는데 엄청 미안했다 자세만 봐도 실패  서핑 마지막에 어떻게 착지해야하는지 몰라서 좀 당황했다  어차피 실패하고 입수했지만 그래도 혹시 성공할때를 대비해서 실패 동영상 모아보기 실패하는 것만 봤으니까 성공하는 움짤도 보기  사실 이 움짤 찍힐때가 가장 성공에 가까웠을땐데  동영상이 아닌 움짤이라 아쉽다 100장에 가까운 사진을 이어붙여서 용량때문에 작게 만들었다 이 때 서핑 성공하고 뒤에서 웃던 강사님 표정 포착  처음 성공한건가 암튼 이때 따봉도 날려주심  신난다 오예 오빠도 내가 언제 성공할지 모르다가 성공하니까 급하게 찍었다  움짤이나 사진을 동영상으로 바꾸는 방법 좀 알려주세요 성공 비스무리한 영상 모음 서핑보드 위에 일어는 났는데, 파도가 없는 어처구니 없는 영상 모음 서핑을 같이 배우는 사람들이 있었으면 더 재밌었을텐데..  그리고  서핑보드에 엎드려있으면 왜그리 코에서 물이 나오는건지  코에 수도꼭지 있는줄 넘어지는 영상 모음 다행히 저렇게 넘어졌어도 바닷물은 마시지 않았다  다만, 입가에 묻은 소금기가 입안에 들어올땐 짜다못해 썼다 설명은 듣지만  머리로는 이해하고, 몸이 안따라줘서 문제 이안류가 있다며 자리를 이동했다 파도 타이밍 맞추기 어려움 파도가 생기다가 없어지고  혹은 갑자기 파도가 빨라지고  파도 타이밍 맞추는게 제일 어려웠다  그리고 나는 패들링만 했다하면 성공률 0%라서  아예 패들링 빼고 하자고 하셨다  그래, 나도 그게 좋겠다는 생각을 했다 점점 힘 빠지면서 실패율 높아짐 서핑이 이렇게 힘든 스포츠인줄 몰랐다  놀 땐 그냥 힘들다 였는데  다음날 걷기 힘들정도로 근육통이 왔다  그래도 재미는 있었는데  아쉬운건 물이 좀 따듯했으면 했다  너무 추워서 손이 저렸다 이제 강사님 없이 혼자 연습을 하게 됐다  혼자여서 좀 겁나기도 했는데  몇 번 짧은 성공은 있었다 추워  혼자서도 엄청 씩씩하게 서핑했다  오빠는 지인분들 서핑하는 것도 찍어주느라 바빴다 또 파도 타이밍 못맞추고 그냥 서있음  옆에 보니까 미취학아동으로 보이는 꼬맹이도 잘 하드만  이거 면목없구만 다음은 웨이크보드 도전해보고 싶다  수상레저 서핑보드 서핑입문 초보서퍼 서핑강습 양양서핑 오닐서프 강원도양양 강원도여행 남애3리해수욕장 강원도 양양군 현남면 남애리 오닐서프 강원도 양양군 현남면 매바위길 175 ']",http://blog.naver.com/PostView.nhn?blogId=songek27&logNo=221601414291&redirect=Dlog&widgetTypeCall=true&directAccess=false
2018-01-01,엄친며 스토리♩,"["" 양양횟집 창횟집 운치있게 회 즐기기 재작년, 해산물 먹고 저희 가족 모두가 노로바이러스로 고생을 했어요 그 뒤로 해산물 먹는게 겁 났는데 동해까지 와서 회를 안 먹고 가는건 괜히 아쉽더라고요  '이번에 큰 맘 먹고 한 번 먹어봐 ' 깨끗하고, 깔끔하게 나오는 횟집을 (동생이) 폭풍검색 합니다 '동생아, 땡큐' ' 현지인 들이 이용하는 횟집 어떠냐'는 동생 당연히 오케이지요 0 양양 창횟집 으로 고고 왜 상호명이 창횟집인가 하면요 창 밖 풍경 을 보며 회를 즐길 수 있어서 창횟집 이래요 창과 멀리 떨어진 곳에 앉아 바다를 훤히 볼 수는 없었으나, 멀리서 보는 바다도 좋았어요 양양 남애창횟집 메뉴 및 가격 저흰 무난하게 모듬 중 으로 주문했어요 매운탕, 어죽 도 포함 되더랍니다  스끼다시들 스끼다시가 푸짐하게 나오는건 아닌데, 멍게, 해삼, 전복, 문어, 새우 등등이 종류별 로 나오네요 오도독 씹히는 해산물 왜 이렇게 맛있는거니 진심새우 빼고 다 맛있었어요 ( 새우는 좀 딱딱했음 ) 꽁치 도 나왔는데 요건 맛을 못 봤네요 ( 꽁치 말고도 먹을게 많아서.. ) 특별해 보이는 요 양념장은 그냥 쌈장 이었다능 회 쌈 싸묵어 회 에는 소주 라지요 소주 한잔 마시고...맛 없어서 맥주 로 갈아탔지만 술 한잔 하기 좋은 한 상이었어요 이제부터가 시작이닷 모듬회가 나옵니다 모듬회 中 (100,000원) '중' 사이즈는 4명이 즐기기 충분한 양이었어요 스끼다시, 어죽, 매운탕 이 같이 나와서 가능  싱싱한 회 도다리, 광어, 우럭 3종이 올라가 있어요 먹을 땐 분명 알고 먹었는데,, 지금 보니 이게 어떤 생선인지 도통 모르겠네요  그냥 도톰 하게 썰려 나와서 , 초고추장 듬뿍 찍어 먹었고요 회 조직 단단한 우럭이 제일 맛있었다는 것만 기억나요 ( 우럭 > 도다리 = 광어 순이었음 ) 그리고 이건 어는 횟집을 가도 똑같이 느끼는거죠 배 지느러미 부분이 짱 입니다요 (고소 고소해) 보통은 회 다 먹고, 매운탕에, 어죽을 먹는다는데 저희 집은 펼쳐놓고 먹는걸 좋아해서요 한번에 다 달라고 했어요 매운탕 보글보글 보통의 매운탕에는 생선 가시만 앙상하게 들어가잖아요 창횟집 매운탕엔 생선 가시 도 많고, 가시에 살 도 많이 붙어 있어요 생선 가시 덜어서 먹는데 먹어도 먹어도 끝이 없었답니다 ( 살코기가 보드라워서질리지 않았음 ) 탁하지 않은 칼칼한 시원함 에 앞에 두고 퍼먹 퍼먹 매운탕 국물맛이 끝내줍니다 어죽 양양 서핑족들이 즐겨 먹는다는 창횟집 어죽 생선 갈아만든 어탕죽 을 상상했는데 어죽 과 어탕죽 은 완전 다른거 였어요 말 그대로 어 죽 은 죽 미역 이랑 떡국 이 들어간 어죽 자세히 보면 흰살 생선 도 들어가 있어요 0 고소한 맛 으로 뜨끈하게 속을 달래주는 맛 ( 전복 대신 흰 살 생선 들어간 전복죽맛 ) 서핑족들이 왜 어죽을 아침밥으로 선택하는지 알겠더라고요 ( 강추 ) 마지막 마무리는 흰앙금 들어간 송편 으로 끝 아, 나올 때 코코아 한잔이 진정한 끝이었네요 코코아 있는 집 좋아 [ 양양횟집 남애창횟집 ] 회도 좋았지만 매운탕, 어죽, 스끼다시가 인상 깊은 집이에요 깨끗한 집으로 추천하는 횟집입니당 ( 다시가면 어죽을 뜨뜻하게 먹고 나올 듯 ) 창횟집 강원도 양양군 현남면 동해대로 254 남애창횟집 전화 상세보기 <a onclick=return false; href=bSize style=display:none target=blank class=semaplink selink data-linktype=map data-linkdata={&quot;eventTarget&quot;:&quot;button&quot;,&quot;didSearch&quot;:&quot;false&quot;,&quot;searchEngine&quot;:&quot;NAVER&quot;,&quot;locationId&quot;:&quot;15081652&quot;,&quot;latitude&quot;:&quot;37.933544&quot;,&quot;markerLatitude&quot;:&quot;37.933544&quot;,&quot;markerLongitude&quot;:&quot;128.789528&quot;,&quot;title&quot;:&quot;창횟집&quot;,&quot;longitude&quot;:&quot;128.789528&quot;}>지도보기</a>""]",http://blog.naver.com/PostView.nhn?blogId=sjh5418&logNo=221170367786&redirect=Dlog&widgetTypeCall=true&directAccess=false
2019-08-01,주톰이의 일상,"[' 아농아농하세요 주톰이입니당 양양 남애처녀횟집 다녀왔어요 주톰이 아부지께서 예전에 자연산 바다 고기 도매를 하셨었는데 그 때 거래처였다면서  입맛 까다로운 주톰이 아빠가 자연산 회 강추한다며 다녀 온 처녀횟집  정말 먹어보니 비릿한 맛도 전혀 없고 살도 오동통 하니 너무 맛있게 먹었어요   자연산의 위엄,, 처녀횟집 외관, 입소문 났다던데 역시나 차가 많았던 방안에서 먹을 수 있지만 이렇게 신선처럼 바깥에서 바다를 보면서 먹을 수 있더라구요 요렇게 바다가 보였어요 주톰이는 바다가 보이는 방으로 들어왔습니다  에어컨 땜시 . 요렇게 조개탕이 나왔어요 펄펄 끓여서 먹으니 크으,, 스끼다시. 다른 횟집과 다르게 전이나 튀김이 아닌 요렇게 싱싱한 해산물이 나옵니다. 이게 여기 처녀횟집 클라스 각자 나온 샐러드 회가 나오기 전  자연산 도다리회를 시켰어요 회 좀 먹어보고 다녔다 싶었는데 그 중에서도 최고는 역시 오늘 , 여기 도다리 회였어요 쫄깃쫄깃한 식감에 비리지도 않고 씹으면 씹을수록 고소했어요 역시 해산물 쪽에서 20년 넘게 일한 아빠의 픽  장에 , 깻잎에, 도다리회 안농 성게알 넌 무슨 맛이니 정말 계속 먹고 싶은 맛이구나...  그 다음 나온 전복치-쥐치회 넘나 맛있어서 회 다 먹어 버렸당 행복한 날 처녀횟집 클라스 그야말로 죽인당 이왕 회 먹을거 좀 돈을 더 내도 자연산으로 처녀횟집 와서 먹을거라는 주톰이의 다짐 회 뿌셔뿌셔 하고 식사로 어죽이 나왔습니당 가다랑어포 맛도 나는것이 맛있고 고소 마지막에 누룽지처럼 붙은 죽이 참말로 맛있데이  앗, 매운탕은 넘 배불러서 포장해왔다 저녁에 집에서 가족들과 이차전 시작 할거다 잊지 못하는 자연산 회와.. 성게알 신기했다  눈과 입이 즐거웠던 처녀횟집 조만간 재방문 할거임']",http://blog.naver.com/PostView.nhn?blogId=madarimid&logNo=221612039192&redirect=Dlog&widgetTypeCall=true&directAccess=false
2018-09-01,진주쌤,"["" 양양 남애해수욕장에 위치한 분위기 좋은카페 굿모닝하와이&서핑 안으로 들어가 볼까요. 저와 친구들은 야외에서 먹기로 했어요. 바람이 적당히 부는것이 참 좋드라그요  야외추천. 이곳에 오면 꼭 먹어야 하는 로니새우밥 친구 셋이 2개 주문중 ..... 새우가 오통통 짱크고,푸짐합니다 맛나,맛나 가격;9,000원 남애해수욕장 오게되면,꼭 들를곳 굿모닝하와이&서핑 정했다 &서핑처럼 이곳 사장님은 서핑도 같이 운영한답니다 바로카페앞 해변에서 서핑도 같이 이용하실수 있어요 굿모닝하와이&서핑이 궁금하신곳은 자세한 것은 아래 사이트에 나와있어요 http://goodmorninghawaii-surf.com/surf/ Surf – Good Morning Hawaii Surf Surf & guest PRICE 서핑보드대여 소프트보드(입문자용)  30,000원 에폭시보드  40,000원 (온수샤워포함) (슈트요금별도 10,000원) 강습 (보드,슈트 포함) 서핑강습 70,000원 (온수샤워포함) 스노클링 장비 렌탈 구명조끼 10,000원 수경 5,000원 (온수샤워별도 3,000원) 구명조끼&수경 렌탈 시 온수샤워 무료 수건대여 1,000원 개별 이용 요금 & 야외 바베큐 야외바베큐 20000(1인요금) 장소 : 하와이 까페 야외 바베큐장 open 19:00 close 24:00 무제한이용 2시간제한 제공... goodmorninghawaii-surf.com 이날은 파도가 없어서 서핑을 하지않았지만 꼭,서핑을 하지 않더라도 매력적인 양양 남애해변을 바라볼수 있다는게 좋은시간 이였어요 굿모닝 하와이 & 서핑 강원도 양양군 현남면 화상해안길 247 저장 관심 장소를 MY플레이스 에 저장할 수 있어요. 팝업 닫기 '내 장소' 폴더에 저장했습니다. MY플레이스 가기 팝업 닫기 전화 상세보기 <a onclick=return false; href=bSize style=display:none target=blank class=semaplink selink data-linktype=map data-linkdata={&quot;eventTarget&quot;:&quot;button&quot;,&quot;didSearch&quot;:&quot;false&quot;,&quot;searchEngine&quot;:&quot;NAVER&quot;,&quot;locationId&quot;:&quot;37747418&quot;,&quot;latitude&quot;:&quot;37.9342782&quot;,&quot;markerLatitude&quot;:&quot;37.9342782&quot;,&quot;markerLongitude&quot;:&quot;128.7889403&quot;,&quot;title&quot;:&quot;굿모닝 하와이 &amp;amp; 서핑&quot;,&quot;longitude&quot;:&quot;128.7889403&quot;}>지도보기</a> 굿모닝하와이 굿모닝하와이&서핑 남애해수욕장 양양서핑 남애서핑 로니새우밥 새우밥""]",http://blog.naver.com/PostView.nhn?blogId=2515652&logNo=221361940989&redirect=Dlog&widgetTypeCall=true&directAccess=false
