post_dates,title,full_text,url
2019-09-01,Easy_zero_moment L...,"['   지난 주말, 새벽 네시 강원도로 출발했다 차막히는거 극도로 싫어하시기때문에  3시반 기상, 4시 출발했다 내가 잠이없으니 망정이지 무튼, 우린 가는길 아침을 먹고가기로 했다. 양양 남애 쪽에 맛있는 해장국집이 있다고 몇번이고 말했던 곳인데 겸사겸사 먹고가기로했다  우리가 도착할때쯤이 6시 30분이였는데 이때 문을 열었을까 했는데,,, 새벽 5시 30분부터 오픈하신다고하여 바로 고고고고고고           나는 선지, 오빠는 소고기해장국 신풍해장국 이라는 곳인데 나도 정말 맛있게 그리고 배부리먹고왔다 입맛이 까다로운데 여기 해장국이 그렇게나 맛있다며 개운하다며 노래노래노래 부르며 룰루라라랄라 했던 곳이 바로 여기  양양 하조대 IC 지나와서 기사문, 죽도, 인구 지나고 남애삼리 가는길목에 위치한 식당이였다. 처음 서핑을 시작했을때 맨날 기사문옆에서 편의점사먹고 그랬는데  왜 양양 맛집 투어를 안다녔을까 아쉬운 마음이 잠시잠깐들었다             그리하여 여섯시반 신풍해장국 도착 식당에 들어서니 맛집의 뉘앙스 + 아쿠아맨 ()의 느낌이 물씬 풍겼다  식당 한켠 벽에는 바다속 사진이며, 서핑사진들이 있었고 테이블쪽에는 카메라들이 즐비해있었다 괜히 이런느낌 () 에 아, 여기 맛집이구나 생각했다.  바다 바로 앞도 아니고 도로변 한가운데 있는 식당인데 새벽부터 오픈을한다니           이야기를 들어보니 신풍해장국 여기는 사장님 (남편)분은 주방에서 음식을 맡아하시고 사모님은 홀에서 서빙을 해주시는 듯 했다. 음식들은 직접 재배하시거나 이른 새벽 신선한 재료를 공수하신다고 하셔 기대 만발하며 음식을 기다렸다           기본 찬은 이렇게 나오는데 나는 무말랭이하고 부추가 너무 맛있었다. 부추는 찬 내어주실때 바로 직전에 버무려서 주시니 아삭아삭해서 더 맛있었다.  그리고 오빠가 여기 신풍해장국에 데려오면서 고추가 그렇게 맛있게 맵다고 꼭 얘기해서 같이 먹어야한다고 해서 이모님께서 고추를 조금 내어주셨다          오빠가 알려준 신풍해장국 먹는 팁 1. 주문할때 다대기는 따로 달라고한다. 2. 해장국이 나오면 다진마늘을 한스푼 넣는다. 3. 다대기를 한스푼 정도 풀어 넣는다. 4. 매운고추를 송송 잘라 넣는다.          보글보글 10분 정도걸려 음식이 나왔고 오빠가 알려준대로 척척척척           요 검은색 빛 나는것이 다대긴데 으므나 세상에 직접 맹드신 다대기라 그런지 조금만 풀어넣었는데도 개운한 맛이 추가되더라  마늘넣고 다대기넣고 고추넣고 한뚝배기 정말 맛있게먹었다. 비린내며, 텁텁함이라곤 1도 없고 시원하고 개운하고 깔끔하게 선지도 탱글탱글 엄청 신선했는데 이제 더이상 사진이고 뭐곸 한뚝배기하느라 남기지 못해,, 전할방법이 없네,,,, 선지해장국안에도 소고기가 조금씩 들어가있었는데 부드럽고 녹던데,,,,  어쩔 수 없이 다시한번가서 사진을 남겨오리다          각자 완뚝배기하고 반찬도 몇번이고 리필해먹으며 한끼 제대로 먹었다 신풍해장국 7,000원씩이라 가성비 + 가심비도 좋았던 식당이였다 전체적으로  저녁에 술안주로도 좋겠다는,, 다음엔 포장을 해볼까나 아 그리고 태풍 링링이 온다는 소식 () 에 오전만 탈 수 있겠거니 하며 서둘러 출발하였건만 옆에보이는 바다가 장판,,, 이여,,,,, 일단 이렇게 배 두둑히 밥먹고 7시쯤 금진으로 다시 재출발을 하였다       ']",http://blog.naver.com/PostView.nhn?blogId=zi02_&logNo=221644171980&redirect=Dlog&widgetTypeCall=true&directAccess=false
2018-09-01,"이을, Guitar&Music","[' 안녕하세요 당신과 음악을 이을 기타&뮤직 입니다 오늘은 이을의 음악이야기가 아닌 여행이야기를 들려드리려고 해요 지난주 태어나서 처음으로 서핑에 도전하러 강원도 양양에 다녀왔어요 동서울 터미널에서 고속버스를 타고 이동했는데 2시간밖에 걸리지 않더라구요 이렇게 가까운줄 알았으면 더 빨리 왔을텐데0 강원도 양양에서 서핑을 하는 분들은 서피비치 를 많이 찾는다고 하시는데, 저는 남애 해변을 선택했어요. 서핑이 처음이라 여기저기 조사해 보니 서피비치보다는 남애 해변 이 파도가 좋고 한적해 더 재밌게 서핑을 할 수 있다고 하더라구요 태어나서 처음으로 서핑을 배우기 위해 선택한 곳은 강원도 양양 남애 3리 해변에 위치한 디스커버리 리조트 도착하자마자 너무 떨렸어요.. 처음하는 서핑이라 너무 기대되고 두근두근.. 디스커버리 리조트 는 강원도에서 서핑 강습을 하는 곳 중에 가장 큰 규모라고 해요 카페부터 편의점, 숙박 식당, 야외태닝장, 샤워장 등등 다양한 부대시설이 많았어요 도착해서 실제로 보니 열심히 조사한 보람이 있었어요 본격적으로 서핑을 하기전 시원한 음료 한 잔 디스커버리 서핑 카페에서 가장 잘 나가는 메뉴라고 해서 코코넛이 들어간 부코 스무디 를 시켰는데 진짜 너무 맛있었어요0 1박하는 동안 세 잔은 마셨나봐요 완전 강추 입니다 서핑하는 사진을 보니 다시 설레였어요 한번도 서지 못하고 가는건 아닌가.. 걱정이 앞섰어요 수트 고르기 저는 비수기 평일에 가서 수트, 보트, 강습, 샤워장 이용을 5만원에 싸게 예약했어요 숙박도 5만원으로 바닷가 리조트를 고려하면 저렴했어요 모든걸 한 곳에서 편하게 다 할 수 있는게 장점인 것 같아요 방에 올라가 짐을 풀고 수트도 미리 한번 입어봤어요 야외에 샤워장이랑 탈의실이 있는데 처음이라 뭔가 부끄러워서 연습삼아 미리 입어 봤습니다 수트 착용 완료 서핑 수트는 부력을 위해 두께가 있어서 몸이 많이 드러나지는 않았는데 그래도 뭔가 민망하네요 서핑 강습은 이론 30분+실습 1시간으로 이뤄졌어요 강사님 포스에 눌려서 서핑 용어, 안전 수칙, 서핑 방법 등을 아주 열심히 배웠습니다 이론을 마치고 바다로 나가 본격적인 서핑을 배웠어요 눕는 방법부터 손을 젖는 패들, 일어서는 방법을 배우는데 생각보다 체력이 많이 필요했어요 평소 운동을 하지않은게 여기서 다 들통이 나네요 모든 강습이 끝나고 바다로 출발 이까지 꽉 물고 열심히 패들 강사님에 신호에 업 표정관리는 전혀 할 수 없어요 멋지게 넘어졌습니다 업 할때 손을 짚는 위치가 너무 앞으로 쏠려서 보트가 물속으로 잠겼어요 파도 고르는 방법도 배워서 나름 열심히 찾아보는데 잘 보이지가 않네요 첫 날은 네번정도 일어섰는데 멋지게 일어선 사진은 찍을 수가 없었어요... 그래도 버킷리스트를 하나 이뤘다는 마음에 신나서 서핑하는 시간이 너무 즐거웠어요 서핑을 끝내고 시원하게 맥주 한잔 숙소가 바다와 10초 거리에 있어서 바닷가에 앉아 생맥주를 즐길 수 있었어요 이 상쾌함을 잊을 수가 없네요 디스커버리 리조트엔 먹을게 참 많아요 상하목장 우유로 만든 아이스크림이 있다고 사장님이 말씀해주셔서 먹었는데 물놀이를 하고 나서인지 제가 지금까지 먹었던 아이스크림 중에 제일 맛있었어요 4천원짜리 아이스크림으로 이렇게 행복할 수 있다니 서핑을 더 빨리 알았다면 샤워를 하고 쉬다보니 어느새 저녁이 되었어요 1박으로 온거라 시간이 너무 빨리 지나는 것 같아 서운했어요 서운할 땐 역시 고기죠 바닷가에서 숯불에 구워먹는 고기 맛은 언제나 옳습니다 만원이면 바비큐 세트를 구매할 수 있으니 양양시내에 하나로 마트에서 꼭 고기 사가세요 기분좋게 한잔하고 디스커버리에 사는 강아지랑도 친해졌어요 이렇게 재밌는데 벌써 마지막 밤이라니 너무 아쉬웠어요.. 둘째날 아침, 날씨나 너무 좋아서 바닷가 산책을 나갔어요 혼자 보기 아까워서 영상으로도 촬영해왔어요 깨끗한 강원도 양양 남애3리 해변 구경해보세요 둘째날도 바로 바다로 향했어요 전날보다 하늘이 맑고 파도도 좋았어요 둘째날은 강사님 없이 혼자서 도전했어요 어제보다 더 멋있게 파도를 타겠다는 의지에 불타서 바다로 돌진 바다를 지켜보며 탈만한 파도를 고르고 패들패들패들 업 파도가 잔잔해서 빠르게 타진 못했지만 일어서는데 성공했어요 이 사진이 첫 서핑 도전에 베스트 컷이에요 오랜만에 몸을 써서 그런지 금새 지쳤어요.. 물속에선 안보이던 파도가 밖에서 보면 왜 이리 잘 보일까요.. 기다려도 오지 않던 좋은 파도가 물에서 나오면 쉴새없이 왔어요 집으로 출발하기 전 디스커버리 리조트에서 파는 남애리 화덕피자와 치킨으로 점심을 해결했어요 2층 테라스에 앉아 바다를 바라보며 먹는 치맥 피맥이 환상이었습니다 처음 부터 끝까지 행복했던 서핑 여행 집에 갈때는 사장님께서 터미널까지 데려다주셨어요 몰랐는데 올때도 미리 전화하면 픽업서비스도 해준다고해요 주문진에선 무료, 강릉 KTX에선 오천원이라고 하니 참고하세요 양양으로 여행가시는 분들께 도움이 될까해서 양양터미널 버스시간표도 첨부할게요 집으로 가는길이 너무 아쉬울 만큼 즐거운 여행이었어요 강원도로 서핑을 도전하러 가신다면 남애3리 완전 추천드립니다']",http://blog.naver.com/PostView.nhn?blogId=ieulguitar&logNo=221354449333&redirect=Dlog&widgetTypeCall=true&directAccess=false
2019-11-01,니쥬의 대모험♬,"["" 전날 먹은 속초 가리비 꿀맛탱 전날 술 마시고 한 짓 : 로고 돌고래 눈뽕  0. 아침에 6시 반에 일어나서 가기로 했는데 전날 숙취로 좀 늦잠잤다. 일어나서 컵라면 1개 반 조지고 9시 보트 다이빙을 위해 급히 갔다.  나도 이제 펀 다이빙 할수있다  이때까지만해도 에너지 좋았지... 후... 배불러서 이래도 되나 했는데...   1. 1깡째. 포인트 명은 '오대산'. 다른 것보다 어제에 비해 바다벌레 같은게 엄청 붙어서 신경쓰였다. 뭔가 우수수 기어다니는데 신기하기도 하고 귀엽기도 하고. 검색해봤는데 바다 대벌레랬나 여러 종류가 있었는데. 투명한 것도 있고 무늬 있는 것도 있고. 사실 벌레 관찰하느라 해양 속에 대한 기억이 좀 적다.  오대산이라고, 지형이 매우 아름다운 포인트라고 하는데 확실히 주위를 둘러보면서 등산하는 기분이 들었다. 산이 바다에 잠기면 이런 느낌이겠다, 싶은 포인트, 생물들도 많았고 바다 달팽이도 봤다. 왕신기.  전날 보았으나 이름을 알아내는데에 실패한 생선을 또 봤는데, 여전히 정체를 모르겠다...  요번에 찍힌 것 중 가장 맘에 드는 세 샷. 찍어준 모임 오빠한테 감사를 드립니다. 진짜 사진 다시봐도 이번 동해 시야 터진듯. 올 마지막 동해가 이렇게 맑아서 기분 좋다. 남애 최고에용. 그리고 5m 안전정지 하다가 상승함 헤헤... 보트에 안전 싸인 보내고 교류했어야했는데, 물에 고개 쳐박고 일행 상황 보느라... 보트 선장님이 사고자인줄 안다고, 그런 일이 있으면 신호해줘야한다고 했다. 앞으론 신경쓰자.   첫 깡 끝내고 비치인원 구경. 지쳤지만... 발도 시렸지만... 그치만 2깡 치겠다는 일념 하나로 슈트, 슈즈, 하나도 안벗고 버텼다.  2. 2깡. 환경어초 포인트. 뼈대만 있는 콘크리트 육면체 모양 구조물들이 쌓여있고, 그 사이로 각종 어초와 생물들이 살아가는 아름다운 포인트... 였으나. 수온약층 너무 추웠다. 욕나오는게 뭔지 알겠더라. 가장 추운 곳은 9도 나왔다. 웃긴게, 10.4도는 또 덜춥다. 1도의 차이가 그렇게 간사하다. 내려오면서 붙은 바다벌레가 수온 약층에서 다 사라져버렸다. 얼마나 추웠던거니. 하지만 정말정말 아름답고 좋았는데 정말 추웠다.  옆에 어떤 사람이 손시린지 손 비볐는데 대체 누군지 기억이 안나네. 하강, 상승 둘 다 어느 기점에서 조류가 심해서 하강줄 잡고 안전정지했다. 올라오면서 온도가 14.5도 찍히는걸 보며 행복해했던 기억이 난다. 배 위는 그나마 따뜻했는데, 항구로 돌아가는 도중 너무 추워져서 호다닥 샤워장으로 도망갔다.  씻고 슈트 벗고 세척하고 옷 입고 장비 담그고 짐정리하고 소금물 마저 빼고 장비말리고. 근데 비온단 이야기 있어서 말린 장비 롤백에 다시 넣어두고 카페에 뒤늦게 올라갔다.  올라가니 이번 오픈워터 교육생들의 라이센스 카드, C-Card 수여식이 진행중이었음  양양해양스쿠버캠프 3층에 있는 고래카페. 창이 크고 발코니도 넓어서 풍경이 좋다. 포스팅을 따로 하고 싶어서 이때 열심히 사진도 찍었다. 다이빙 하는 도중은 정말 행복하고 나오면 정말 힘든데 조금 더 힘을 내서 정리를 다 하고 이런 곳에 퍼져 있을때의 기분이 좋다. 보람찬 느낌.  고래카페 강원도 양양군 현남면 남애리 2-81 고래카페 딸기쉐이크. 단걸 별로 안좋아하는데 이땐 쭉쭉 들어갔다.  다들 생각보다 여기서 지체가 되었다. 퍼져있다가 물회를 먹으러 갔는데, 사실 그때부터 너무 피곤해서 난조. 식당에서도 해프닝이 있었으나 뭐, 됐다. 밥도 배불리 먹고 차를 얻어타고 서울로 돌아와 택시타고 집에 도착했다. 차에서 기절하다 수다떨다. 양양-서울이 거의 4시간 걸렸다. 중간에 홍천 휴게소도 들렀지만, 그래도 겁나 걸리긴 했네. 새벽에 달리면 2시간 쯤인데.    집 비워서 죄송합니다.  집에 와서... 날 원망하는 고영님을 만져드리고. 방 쓸고 청소하고 고양이 화장실 치우고 밥 정리하고 물 정리하고 가방 정리하고 바닥 닦고 장비 꺼내서 세척하고 말리고 옷 세탁기 돌리고 를 한 시간에 끝내고 뻗었는데 할 일이 여전히 많아서 또 늦게 잤다. 진짜진짜 힘들긴 한데 바다 다녀온걸 후회하진 않는다.  동해는 매력적인 바다다. 또 가고싶다. 나는 드라이 슈트가 없으니 올 동해는 이번이 끝이다. 빨리 내년이 왔으면 좋겠다.  다이빙 일기 끝   P.S. 양양스쿠버해양캠프의 멍멍이, 해랑이. 수영을 좋아하는 친구. 귀엽다. 1깡 끝내고 발시려운데 내 발에 드러누워서 발을 데워주었다. 고마워 해랑. 내년 개해제 때 다시보자. ""]",http://blog.naver.com/PostView.nhn?blogId=eun_bear&logNo=221711340806&redirect=Dlog&widgetTypeCall=true&directAccess=false
2019-06-01,해바라기의 행복한 이야기,"[' 남애항에 가서 저녁엔 회를 먹고 아침 식사를 어디서 먹을까 고민했습니다. 양양 쏠비치 근처 맛집이라는 곳을  몇 번 갔는데 사람은 많고 블로그 리뷰와 달리 만족도가 떨어져서 근처에서 가볍게 먹고 가기로 합니다. 직접 계산했습니다 광고 아니고 개인적인 취향이니 참고만 하세요 남애제일식당 2호 또 도움을 받았습니다. 감사합니다. 남애 제일 식당 2호 횟집이  맛있다고 합니다. 그런데 T.T 문이 닫혀 있습니다. 간판에 있는 전화번호로 전화를 합니다. 밭에 가셨다고 합니다. 순간 밭이라면 직접 재배한 농산물 그냥 갈까 잠시 고민하다 스카이 워크나 한 바퀴 돌자고 하고 기다리기로 합니다. 남애제일식당 강원도 양양군 현남면 매바위길 138 남애제일식당 메뉴 사실 메뉴도 모르고 왔습니다. 횟집인데 아침식사를 하는 곳이구나 했는데 메뉴는 빡작장을 기본으로 한 생선구이정식 생선조림정식입니다. 빡작장 비빔정식 7,000원 모듬생선구이정식 10,000원(2인 이상) 모듬생선조림정식 12,000원(2인 이상) 내부는 깔끔하게 정돈되어 있습니다. 수저 통에 있는 메뉴입니다. 성인 기준 1인 1메뉴 주문을 부탁한다고 되어있습니다. 벽에 설명이 잘 되어 있어서 바로 모듬생선구이 정식 2인을 주문합니다. 아이 밥과 여유 밥까지 1000원  25,000원 계산했습니다. 남애 제일식당 원산지 원산지 안내입니다. 김치는 주인장이 직접 담그고 고춧가루는 농사지은 태양초 생선은 남애항 앞바다에서 잡아 올린 생선을 남애항에서 직접 구입을 하시고 빡작장은 주인장이 직접 개발한 강원도식 강된장 각종 채소류는 직접 농사를 짓거나 지역 농가에서 재배한 순수 국내산 채소 주문하고 기다리면서 일단 잘 왔다는 생각을 했습니다. 빡작장이 기대됐고 일단 재료가 뭐 국산에 대부분 직접 공수를 하신다고 하시니 더 신뢰가 갑니다. 이런 곳이 숨은 맛집이지요 매년 양양 속초 삼척 쪽으로 여행을 가지만 은근 실패가 많았는데 남애항은 또 와야겠습니다. 맛있는 횟집도 있고 밥집도 있고 빡작장과 오징어젓갈 자연산 반건조 오징어도 판매하고 있었습니다. 빡짝장 벽면에 메뉴 설명과 함께 빡작장을 맛있게 먹는 방법도  있습니다. 빡작장 설명 빡작장에 대한 내용입니다. 남애항 밥집 잠시 후 등장한 생선조림정식입니다. 두부조림과 나물, 김치, 된장국, 오징어젓갈, 빡작장입니다. 아이 먹으라고 김도 주십니다. 시금치 된장 국인가 하고 남편이 한입을 먹더니 여기 맛있다고 아주 신나합니다. 양양 생선조림 생선조림엔 가자미 2마리 열기 2마리가 나옵니다. 생선 크기로 좋고 살도 많습니다. 2인 기준으로 넉넉한 양이라 생각됩니다. 일단 비주얼이 맘에 들었는데 양념이 딱 좋고 생선 살도 보들보들 좋은 재료로 맛있는 맛을 자연스럽게 이끌어 낸 느낌입니다. 하나하나 맛이 좋습니다. 화려하진 않지만  좋은 재료로 정성 들여 만든 맛있는 집 밥 같습니다. 남애 생선조림 맛집 2달 전에 다녀왔는데도 맛이 기억이 납니다. 가볍게 먹을 생각이었는데 생선조림에 밥을 먹고 빡작장에 비벼먹고 밥도둑이 너무 많아 계속 먹게 됩니다.  조림도 맛있었지만 빡작장이나 젓갈 두부조림 등을 생각하면 생선구이를 주문해도 잘 어우러졌을 것 같습니다. 양양 밥집 콩나물무침, 무생채, 시금치나물, 김입니다. 나물류는 그때그때 조금씩 변경되는 것 같습니다. 남애항 밥집 짭조름하면서 은근 칼칼한 두부조림입니다. 이것도 맛있습니다. 빡작장에 나물과 함께 비벼 먹으면 됩니다. 남애항 밥집 남애제일식당 하나하나 젓갈이 안 가는 곳이 없습니다. 사장님 음식 솜씨가 좋습니다. 남애항 맛집 빡짜장 빡작장도 넉넉하게 주십니다. 양 조절을 해가며 먹으면 됩니다. 막장에 냉이 달래 당근 양파 청양고추 대파 등을 넣어 빡빡해질 때까지 졸이듯 끓어서 만든 장이라고 합니다. 양양 맛집 막장으로 만든 진한 시금치 된장 국입니다. 보는 것과 맛이 다릅니다. 그저 소박해 보이지만 깊고 진한 맛이 느껴집니다. 남애항 생선조림 사진을 보니 생선조림 또 먹고 싶네요 대접에 나온 밥도 밥맛이 좋습니다. 남애항 남애제일식당 나물과 김 두부조림을 4분의 1 정도 넣고 빡작장을 적당히 넣고 막장 국물을 조금 넣어서 비벼 먹으라고 설명해 주셔서 그대로 합니다. 남애항 맛집 슥슥 비벼 먹으니 막 들어 갑니다. 물은 셀프입니다. 남애제일식당 생선조림정식  먹는 과정은 찍지 못했지만 아이도  빡작장에 비벼서 맛있게 먹었고 생선도 속살은 맵지 않아서 잘 먹었습니다. 빡작장을 워낙 넉넉하게 주셔서 남겼지만 다른 모른 반찬과 넉넉하게 주신 밥까지 모두 먹었습니다. 원래 중간에  한 끼 더 먹고 집에 가려고 했는데 결국엔 집에서 저녁을 먹었습니다.  아이가 원해서 사온 빡작장입니다. 1만 원에 구매해왔는데 다음에 가면 또 사 와야겠습니다 남애제일식당 택배도 가능하다고 합니다. 정확하진 않지만 4개 이상은 무료배송이라고 하셨던 것 같은데 기억이 안 나네요. 남애 빡작장 고기 먹을 때나 쌈 싸 먹을 때 딱입니다. 호박잎, 양배추 찜 모두 잘 어울립니다. 된장찌개나 청국장 다슬기 해장국을 끓일 때  집에 있는 된장과 함께 넣어 봤는데 진하고 맛있습니다. 기대 없이 갔던 곳인데  정말 맛있게 먹고 왔습니다. 남애항 맛집 남애제일식당 ']",http://blog.naver.com/PostView.nhn?blogId=sunflower7657&logNo=221571122862&redirect=Dlog&widgetTypeCall=true&directAccess=false
